{
  "title": "Host attachment and fluid shear are integrated into a",
  "abstract": "",
  "index_terms": [],
  "authors": [
    {
      "name": "Riddhi Shaha",
      "department": "",
      "organization": "",
      "location": "",
      "email": ""
    },
    {
      "name": "Bangladesh Agricultural University",
      "department": "",
      "organization": "",
      "location": "",
      "email": ""
    },
    {
      "name": "Bangladesh",
      "department": "",
      "organization": "",
      "location": "",
      "email": ""
    },
    {
      "name": "Significance",
      "department": "",
      "organization": "",
      "location": "",
      "email": ""
    },
    {
      "name": "S.A.",
      "department": "",
      "organization": "",
      "location": "",
      "email": ""
    },
    {
      "name": "M.S.I.",
      "department": "",
      "organization": "",
      "location": "",
      "email": ""
    },
    {
      "name": "R.S.",
      "department": "",
      "organization": "",
      "location": "",
      "email": ""
    },
    {
      "name": "S.J.B.",
      "department": "",
      "organization": "",
      "location": "",
      "email": ""
    },
    {
      "name": "G.A.",
      "department": "",
      "organization": "",
      "location": "",
      "email": ""
    },
    {
      "name": "S.A.",
      "department": "",
      "organization": "",
      "location": "",
      "email": ""
    },
    {
      "name": "M.S.I.",
      "department": "",
      "organization": "",
      "location": "",
      "email": ""
    },
    {
      "name": "R.S.",
      "department": "",
      "organization": "",
      "location": "",
      "email": ""
    },
    {
      "name": "G.A.",
      "department": "",
      "organization": "",
      "location": "",
      "email": ""
    },
    {
      "name": "S.A.",
      "department": "",
      "organization": "",
      "location": "",
      "email": ""
    },
    {
      "name": "M.S.I.",
      "department": "",
      "organization": "",
      "location": "",
      "email": ""
    },
    {
      "name": "G.A.",
      "department": "",
      "organization": "",
      "location": "",
      "email": ""
    },
    {
      "name": "S.A.",
      "department": "",
      "organization": "",
      "location": "",
      "email": ""
    },
    {
      "name": "M.S.I.",
      "department": "",
      "organization": "",
      "location": "",
      "email": ""
    },
    {
      "name": "R.S.",
      "department": "",
      "organization": "",
      "location": "",
      "email": ""
    },
    {
      "name": "S.J.B.",
      "department": "",
      "organization": "",
      "location": "",
      "email": ""
    }
  ],
  "sections": [
    {
      "heading": "Results",
      "content": ""
    },
    {
      "heading": "Attachment to Host Cells Triggers LEE Induction in a GrlA-Dependent",
      "content": "Manner. LEE1 is the first transcriptional unit within the LEE\n\nregion and encodes Ler, the master regulator of EHEC virulence\n\ngene expression. Previous reports show only a moderate in-\n\nduction of LEE1 promoter activity on exposure to individual\n\nenvironmental cues, but many of these studies were done using\n\nE. coli K12 as a surrogate strain, thus eliminating many EHEC-\n\nspecific factors relevant to virulence regulation (15, 17). Others\n\nwere done in EHEC strains, but not in the context of host cells\n\n(18). In this study, we set out to investigate the direct effects of\n\nhost cell attachment on LEE-encoded virulence gene regulation\n\nin the EHEC strain Sakai 813, a Shiga-toxin-negative deriva-\n\ntive of the original Sakai isolate. We analyzed LEE1 promoter\n\n(PLEE1 ) activity, using EHEC reporter strains transformed with\n\neither P LEE1-lacZ or P LEE1-gfp transcriptional fusions, on contact\n\nwith host cells. We infected HeLa epithelial cells with EHEC for\n\n4 h and first analyzed LEE1 promoter induction and infection\n\nphenotype in situ, using fluorescence microscopy of P LEE1-gfp\n\nreporter strains. Wild-type bacteria efficiently attached to HeLa\n\ncells and formed actin pedestals, apparent from the fluorescent-\n\nactin staining test, as previously described (Fig. 1A) (19). Most\n\nhost-attached bacteria also showed strong LEE1 promoter acti-\n\nvation. Strikingly, bacteria adsorbed to the glass slide, rather\n\nthan attached to host cells, showed no or low GFP fluorescence,\n\nindicating that ler induction is enhanced on attachment to host\n\ncells compared with exposure to DMEM alone, which has pre-\n\nviously been described as a cue for ler activation (Fig. 1C) (17).\n\nBecause GrlA is a LEE-encoded activator of ler, and thus the\n\nentire LEE region, we also tested LEE1 promoter activation in a\n\nΔgrlA background. In contrast to wild-type bacteria, LEE1 pro-\n\nmoter activity remained low in a ΔgrlA background, even in\n\nbacteria attached to host cells (Fig. 1 B–D). Lower LEE1 pro-\n\nmoter induction, and thus lower activation of the entire LEE\n\nregion in the ΔgrlA background, was also apparent from the in-\n\nfection phenotype: both the number of attached bacteria per\n\nhost cell and the bacteria’s ability to form actin pedestals was\n\nsignificantly decreased (Fig. 1 E and F). Introduction of the\n\ndifferent extrachromosomal transcriptional reporters did not,\n\nin itself, alter the bacteria’s ability to attach or form pedestals:\n\nboth EHEC wild-type and wild-type containing a previously\n\ndescribed, constitutively active P LEE1-gfp fusion (PLEE1 99T-gfp)\n\nshowed similar levels of attachment and pedestal formation\n\n(Fig. S1) (17).\n\nWe also tested LEE1 promoter induction in EHEC strains\n\ntransformed with P LEE1-lacZ transcription fusions. β-galactosi-\n\ndase activity was measured in host-attached or nonattached re-\n\nporter strains isolated from infected host cell cultures and\n\nnormalized to bacterial counts determined from these samples\n\n(Fig. S2A). Exposure to DMEM (the cue experienced by non-\n\nadherent bacteria isolated from infected cultures) resulted in\n\na moderate increase in ler induction, which is in agreement\n\nwith previous findings (17). Host-adherent bacteria, in contrast,\n\nshowed strongly increased LEE1 promoter activity (∼14-fold\n\ncompared with EHEC grown in LB and approximately sevenfold\n\ncompared with DMEM-induced, nonadherent bacteria). Similar\n\nto what we observed with the P LEE1-gfp reporter strain, induction\n\nof P LEE1-lacZ was GrlA-dependent (Fig. S2B). LEE1 induction\n\nwas also observed using PLEE1-gfp and P LEE1-lacZ transcription\n\nreporters in wild-type, but not ΔgrlA, strains on bacterial at-\n\ntachment to Caco-2 intestinal epithelial cells, similar to what was\n\nobserved in HeLa cells (∼10-fold induction compared with\n\nDMEM-induced, nonadherent bacteria; Fig. S3). The ΔgrlA\n\nstrain showed significantly lower levels of attachment and ped-\n\nestal formation compared with the wild-type strain. However, the\n\noverall level of bacterial attachment was lower in Caco-2 cells\n\ncompared with in HeLa cells."
    },
    {
      "heading": "Attachment-Dependent LEE1 Promoter Activation Is Bacteria-Driven",
      "content": "and Is Independent of the Host Response to Infection. Stable at-\n\ntachment of EHEC to host cells is a multifactorial process and is\n\nthe result of a complex interplay between bacterial and host cell\n\nsignaling. This raises the question of whether GrlA-dependent\n\nLEE1 induction is driven by bacterial signaling alone or whether\n\nhost-derived signals, which form part of the host response to\n\ninfection, are required as well. First, we tested whether de novo\n\nprotein synthesis in the host cells was required for attachment-\n\ndependent LEE1 induction. Pretreatment of HeLa cells with\n\ncycloheximide before infection did not change the overall in-\n\nfection phenotype, nor did it alter LEE1 induction levels (Fig. 2).\n\nNext, we asked whether host cytoskeletal rearrangements leading\n\nto pedestal formation were required for LEE1 induction. We\n\nFig. 1. Attachment to host cells triggers LEE1 promoter activation in a GrlA-dependent manner. EHEC wild-type (A) or EHEC ΔgrlA (B) harboring a P LEE1-gfp\n\ntranscriptional fusion as reporter were used to infect HeLa cells [multiplicity of infection (MOI) 10, 4 h]. Samples were fixed and DNA (Hoechst), reporter\n\nactivation (GFP), and F-actin (rhodamine-phalloidin) were visualized by fluorescence microscopy. Several actin pedestals caused by EHEC attachment are\n\nmarked by arrows. Example of an EHEC bacterium adsorbed to the glass slide, rather than attached to host cells, is marked by an asterisk. (Scale bar, 10 μm.)\n\nPercentage GFP-positive bacteria (C), average GFP intensity per bacterium (for GFP-positive cells) (D), number of attached bacteria per host cell (E), and\n\nnumber of pedestals per host cell (F) were determined from these experiments. Data are representative of three independent experiments (>100 HeLa cells\n\neach). The asterisk denotes significant differences between samples based on Student’s t test (P < 0.05). ns, not significant (P ≥ 0.05).\n\nanalyzed infection phenotype and LEE1 promoter activity in\n\nEHEC wild-type-infected HeLa cells after pretreatment with\n\ncytochalasin D, which inhibits actin polymerization, and thus\n\npedestal formation. Although cytochalasin D treatment abol-\n\nished pedestal formation, neither overall bacterial attachment\n\nnor LEE1 activation was affected by the drug treatment (Fig. 2\n\nC–G). We conclude that LEE1 promoter activation is likely\n\nbacteria-driven, as it does not require cues based on de novo\n\nprotein synthesis or actin rearrangements derived from the host\n\ncells as a result of infection.\n\nLEE1 Activation Results Directly from Host Attachment and Is not the"
    },
    {
      "heading": "Result of Positive Selection for Stochastic LEE1 Activation through",